<?xml version="1.0" encoding="UTF-8"?>
<!--
Click nbfs://nbhost/SystemFileSystem/Templates/Licenses/license-default.txt to change this license
Click nbfs://nbhost/SystemFileSystem/Templates/XML/XMLDocument.xml to edit this template
-->
<!--
<!DOCTYPE panaderias [
<!ELEMENT panaderias (panaderia*)>
<!ELEMENT panaderia (idPanadería, domicilio?,telefono+,pedido+)>
<!ELEMENT idPanadería (#PCDATA)>
<!ELEMENT domicilio (#PCDATA)>
<!ELEMENT telefono (#PCDATA)>
<!ELEMENT pedido (fecha, ingrediente+)>
<!ATTLIST pedido
  numPedido ID #REQUIRED
  tipo (urgente | normal) "normal">
 <!ELEMENT fecha (#PCDATA)> 
<!ELEMENT ingrediente (idIngrediente, ano, origen?)>
<!ELEMENT idIngrediente (#PCDATA)>
<!ELEMENT ano (#PCDATA)>
<!ELEMENT origen EMPTY>
<!ATTLIST origen
  continente (Europa | America | Africa) #REQUIRED>

]>
-->
<panaderias xmlns:xsi="http://www.w3.org/2001/XMLSchema-instance" xsi:noNamespaceSchemaLocation="UD4_T4C_yagootero.xsd">
   <panaderia>
    <idPanadería>1</idPanadería>
    <domicilio>Rua Ferrol</domicilio>
    <telefono>692433876</telefono>
    <pedido numPedido="1" tipo="urgente">
      <fecha>11-02-03</fecha>
      <ingrediente>
        <idIngrediente>1</idIngrediente> 
        <ano>2025</ano>
        <origen continente="Europa"/>
      </ingrediente>
    </pedido>
   </panaderia> 
</panaderias>

